<?xml version = '1.0' encoding = 'UTF-8'?>
<configuration xmlns:xsi="http://www.w3.org/2001/XMLSchema-instance" 
               xsi:noNamespaceSchemaLocation="https://bitbucket.org/europeanspallationsource/openxal/raw/site.ess.master/core/resources/xal/schemas/model-impl.xsd"
               subsectionCtrOrigin="false">
               
    <elements>
        <default type="xal.model.elem.Marker"/>
        <drift type="xal.model.elem.IdealDrift"/>
        <rfcavdrift type="xal.model.elem.IdealRfCavityDrift"/>
        <sequence type="xal.model.Sector"/>
    </elements>
    
    <associations>
        <map smf="fm" model="xal.extension.jels.model.elem.FieldMap"/>
        <map smf="sfm" model="xal.extension.jels.model.elem.SolFieldMap"/>
        <map smf="mfm" model="xal.extension.jels.model.elem.MagFieldMap3D"/>
        <map smf="dh" model="xal.extension.jels.model.elem.IdealMagWedgeDipole2"/>
        <map smf="q" model="xal.model.elem.IdealMagQuad"/>
        <map smf="qt" model="xal.model.elem.IdealMagQuad"/>
        <map smf="pq" model="xal.model.elem.IdealMagQuad"/>
        <map smf="dch" model="xal.model.elem.IdealMagSteeringDipole"/>
        <map smf="dcv" model="xal.model.elem.IdealMagSteeringDipole"/>
        <map smf="rfgap" model="xal.extension.jels.model.elem.IdealRfGap"/>
        <map smf="marker" model="xal.model.elem.Marker"/>
        <map smf="DTLTank" model="xal.model.elem.IdealRfCavity"/>
    </associations>
</configuration>
