<?xml version = '1.0' encoding = 'UTF-8'?>
<configuration xmlns:xsi="http://www.w3.org/2001/XMLSchema-instance" 
               xsi:noNamespaceSchemaLocation="https://bitbucket.org/europeanspallationsource/openxal/raw/site.ess.master/core/resources/xal/schemas/model-impl.xsd"
               subsectionCtrOrigin="false">
   
    <elements>
        <default type="xal.model.elem.Marker"/>
        <drift type="xal.model.elem.IdealDrift"/>
        <rfcavdrift type="xal.model.elem.IdealRfCavityDrift"/>
        <sequence type="xal.model.Sector"/>
    </elements>
    
    <associations>
        <map smf="rfm" model="xal.extension.jels.model.elem.ThickRfFieldMap"/>
        <map smf="mfm" model="xal.extension.jels.model.elem.ThickMagFieldMap"/>
        <map smf="d" model="xal.extension.jels.model.elem.IdealMagWedgeDipole"/>
        <map smf="q" model="xal.model.elem.IdealMagQuad"/>
        <map smf="pq" model="xal.model.elem.IdealMagQuad"/>
        <map smf="dc" model="xal.model.elem.IdealMagSteeringDipole"/>
        <map smf="rg" model="xal.extension.jels.model.elem.IdealRfGap"/>
        <map smf="marker" model="xal.model.elem.Marker"/>
        <map smf="rf" model="xal.model.elem.IdealRfCavity"/>
        <map smf="DTLTank" model="xal.model.elem.IdealRfCavity"/>
        <map smf="rfq" model="xal.extension.jels.model.elem.RfqDummyModel"/>
    </associations>
</configuration>

